{
  "productId": "01K5T0Q8C4000000000000P002",
  "type": "stockDecrease",
  "quantity": 2,
  "unitCost": null,
  "reason": "damaged",
  "note": "Dropped pallet",
  "productUnitId": null,
  "enteredQuantity": null,
  "conversionToBase": null,
  "enteredAt": "2026-10-22T08:59:41Z",
  "enteredBy": "Stock room 1 (handheld)",
  "status": "pending",
  "confirmedAt": null,
  "rejectedAt": null,
  "rejectReason": null,
  "qtyBefore": null,
  "qtyDelta": null,
  "qtyAfter": null,
  "stockMovementId": null,
  "branchId": "01K5T0Q8C4000000000000B001",
  "id": "01K80A0J000000000000SA0001",
  "companyId": "01K5T0Q8C4000000000000C001",
  "createdAt": "2026-10-22T09:00:00Z",
  "updatedAt": "2026-10-22T09:00:00Z",
  "rowVersion": 0,
  "deletedAt": null,
  "isDeleted": false,
  "domainEvents": []
}
